query,title,docid,link,rel
T-shirt dress women,IFOTIME Butterfly Mushroom Print Sweatshirt for Women Pullover Aesthetic Graphic Crewneck Casual Oversize Long Sleeved Shirts,459603,https://www.amazon.com/dp/B09H6MV6QK,1
T-shirt dress women,Hmlai Clearance Women 3/4 Sleeve Floral Printed V-Neck Casual Swing T-Shirt Tunic Dress with Pockets,238789,https://www.amazon.com/dp/B07BNFHJDG,4
T-shirt dress women,Haola Women's Summer Loose Fit V Neck Short Sleeve T-Shirt Dress Juniors Casual Shirts Top Blue M,149693,https://www.amazon.com/dp/B083QZZKG4,4
T-shirt dress women,Haola Women's Summer Loose Fit V Neck Short Sleeve T-Shirt Dress Juniors Casual Shirts Top Blue L,326228,https://www.amazon.com/dp/B083R1YTPS,4
T-shirt dress women,Padaleks Women Casual Floral Printed Vintage Jeans Denim Trousers Floor Length Pants Plus Size Relaxed Fit Straight Leg Pant,292445,https://www.amazon.com/dp/B08P3KHLD5,1
T-shirt dress women,Cotton V Neck T Shirt Short Sleeve Button Up Slim Fit Sold Summer Fashion T-Shirt Tops Tee Shirt,228127,https://www.amazon.com/dp/B07RWKRFZS,1
T-shirt dress women,Letdown_Men tops Men Tshirts Graphic Funny Short Sleeve O-Neck African Print Casual Slim Fit Summer Fashion Top Blouse Dark Blue,460141,https://www.amazon.com/dp/B07RJBY17D,1
T-shirt dress women,Mikilon Cosplay Anime Dinosaur Women Sweatshirt Hoodie Costume Long Sleeve Coat T Shirt Top Oversized Yellow,79284,https://www.amazon.com/dp/B07X1LCPF8,1
T-shirt dress women,"vermers Women Clothes, Casual Patriotic American Flag Cold Shoulder Shirt Tops",27716,https://www.amazon.com/dp/B07DKHRLHG,1
T-shirt dress women,Amlaiworld Women Plus Size Tops Summer Short Sleeves V Neck T Shirt Casual Basic Tops Cotton Linen Tunic Shirt,131130,https://www.amazon.com/dp/B07RN8JLRJ,1
T-shirt dress women,POTO Women Maxi Dresses Summer Boho Sleeveless Tank Dress Vintage Print Kaftan Casual Swing Long Dresses with Pockets,464205,https://www.amazon.com/dp/B08Z89G9HZ,3
T-shirt dress women,Striped Crop Tops for Women Collar Half Button Long Sleeve Pullover Sweatshirt Tee Cute Rainbow Tops Shirt for Teen Girl,91424,https://www.amazon.com/dp/B0BBMWTSQN,1
T-shirt dress women,Amlaiworld Women Plus Size Tee Shirt Tank Shirt Open Back Workout Top Shirts Yoga Activewear Exercise Tops T Shirts Tank Tops,475286,https://www.amazon.com/dp/B07QF25FL2,1
T-shirt dress women,Tootu Womens Festival Stripe Plus Size Blessed O-Neck Baseball T-Shirt,110989,https://www.amazon.com/dp/B077R66SXX,2
T-shirt dress women,Women's I Wish Obama Could Stay Longer T-Shirt Large Royal Blue,322752,https://www.amazon.com/dp/B01FEN9IT6,1
T-shirt dress women,jsarle Christmas Dresses for Women 2022 Plus Size Vintage Red Plaid Ugly Xmas Cocktail Party Holiday Dress Formal Christmas-Cloth,264056,https://www.amazon.com/dp/B09LHVNTH8,3
T-shirt dress women,kakina T-Shirts for Women Graphic Tees Vintage Funny Sisters Printed Short Sleeve Tee Tops Summer Casual Loose Shirt,457193,https://www.amazon.com/dp/B08XZK93P8,1
T-shirt dress women,Gahrchian Women Dress V Neck Button Dress Sleeveless Party Dress Ruffle Beach Dress Office Work Skirts Dress,220385,https://www.amazon.com/dp/B07R98YHQ5,4
T-shirt dress women,Cardigoo Long Casual Dress for Women Plus Size Cold Shoulder Floral Lace Maxi Long Dress Elegant Party Evening Camis Dresses Purple 3X-Large,227369,https://www.amazon.com/dp/B09T349Y21,3
T-shirt dress women,Apiesdoreng Ghost Fashion Crew Neck Band Short Sleeve T-Shirt Men/Women 3XL,155629,https://www.amazon.com/dp/B09W1MGHXC,1
T-shirt dress women,Apiesdoreng Ghost Fashion Crew Neck Band Short Sleeve T-Shirt Men/Women XXL,183691,https://www.amazon.com/dp/B09W1LYSHM,1
T-shirt dress women,658 Funny Blouse for Womens Cute Potato Graphic Sweatshirt Fashion Casual Long Sleeve Shirts Stripes Top White,466218,https://www.amazon.com/dp/B08QHJTMV5,1
T-shirt dress women,Womens Christmas Snowflakes Print O Neck Tops Three Quarter Sleeve Round Neck Tee Shirt Printed Daily,479895,https://www.amazon.com/dp/B0BJQN4GWR,1
T-shirt dress women,Aniywn Women Sexy Off Shoulder Half Sleeve Solid Chiffon Pullover Tops Casual T-Shirt,320062,https://www.amazon.com/dp/B07LH329D6,1
T-shirt dress women,"Vedolay Women Short Sleeve Tops, Womens Leopard Print Stripe Cotton Tunic Top Shirt Casual Tees Pullover Blouse T Shirt",150313,https://www.amazon.com/dp/B086C7WLCY,1
T-shirt dress women,Funic Fashion Women Long Sleeve Lace Kimono Cardigan Top Blouse T-Shirt Beachwear,417800,https://www.amazon.com/dp/B07CSPJCDC,1
T-shirt dress women,Hooded Sweatshirts for Women Sport Casual Cute Print Cat Ear Hoodies Long Sleeves Pocket Irregular Loose Top Blouse,325423,https://www.amazon.com/dp/B07X83NQNW,1
T-shirt dress women,Cotton Linen Tops for Women Solid Color V Neck Short Sleeve T Shirt Loose Casual High Low Blouse T Shirt Tops Plus Size,64168,https://www.amazon.com/dp/B08ZK9XB2D,2
T-shirt dress women,Funic Fashion Women Long Sleeve Lace Kimono Cardigan Top Blouse T-Shirt Beachwear,98819,https://www.amazon.com/dp/B07CSNMD2X,1
T-shirt dress women,"Elogoog Lace Dress, Women's Sleeveless Spaghetti Strap V Neck Party Evening Backless Lace Gown Cocktail Dress",484689,https://www.amazon.com/dp/B07CYXZJ5P,3
T-shirt dress women,Funic Fashion Women Long Sleeve Lace Kimono Cardigan Top Blouse T-Shirt Beachwear,138196,https://www.amazon.com/dp/B07CSP4CV4,1
T-shirt dress women,Funic Fashion Women Long Sleeve Lace Kimono Cardigan Top Blouse T-Shirt Beachwear,374789,https://www.amazon.com/dp/B07CSSZL11,1
T-shirt dress women,VAIFTILNO Demin Dress for Women Casual Loose Short Sleeve Lapel Button Down Faux Jeans Mini Dress with Ruffled Hem,222482,https://www.amazon.com/dp/B091FMZYDM,4
T-shirt dress women,"Women Tanktops, Summer O-Neck Tops Shirts Letter Print Sleeveless Workout Tank T-Shirts Graphic Blouse",339464,https://www.amazon.com/dp/B08ZSG238Y,1
T-shirt dress women,POTO Women's Maxi Dresses Floral Printed Sundresses Empire Waist Summer Casual Long Boho Dress with Pockets,26848,https://www.amazon.com/dp/B091J2LR29,1
T-shirt dress women,KYLEON Women's Floral Tie Dye Split Off The Shoulder Ruffle Boho Maxi Long Sundress,273611,https://www.amazon.com/dp/B07S3FF5WR,2
T-shirt dress women,"HYSPORT Dresses Sleeveless Summer 2022 Striped Printed Casual Pocket V-Neck Vest Tie Waist Loose Halter Fashion Beach Short Mini Sundress Basic Comfortable Dressy Dress, C-khaki X-Large",279449,https://www.amazon.com/dp/B09W8VGLLG,3
T-shirt dress women,BCDshop Women Casual Floral 3/4 Long Sleeve Boho Maxi Dresses with Pockets High Waist,219945,https://www.amazon.com/dp/B07RHCQKFF,2
T-shirt dress women,shaozheny Women Tops Womens V- Neck Buttons Up Blouse Shirts Floral Printed Tunic Tops Casual Short Sleeve Loose Tee Shirt,125269,https://www.amazon.com/dp/B091KX6V8G,1
T-shirt dress women,KYLEON Women's Floral Tie Dye Split Off The Shoulder Ruffle Boho Maxi Long Sundress,480851,https://www.amazon.com/dp/B07QQTDLXY,2
T-shirt dress women,Qinnyo Men's Tshirt for Men Tops Baggy Cotton Linen SOID Color Short Sleeve Retro T-Shirts Blouse PulloverTees S-2XL,316352,https://www.amazon.com/dp/B07RBV7PF7,1
T-shirt dress women,"Vedolay Tops for Women Short Sleeve, Women's Feather Embroidered Short Sleeves Plus Size T Shirt Cotton Blouse",261665,https://www.amazon.com/dp/B087MVS3JT,2
T-shirt dress women,"MOOKO Halloween Tops for Women Plus Size Long Sleeve Retro Witch Costume T Shirt Vintage Medieval Cosplay Dress Blouses Red, XX-Large",405386,https://www.amazon.com/dp/B09B34DXCF,4
T-shirt dress women,Tootu Plus Size Summer Tops Women Skull Skeleton Print Vest Tops Blouse Club Party T-Shirt Tee,458773,https://www.amazon.com/dp/B079WJ4V4Z,3
T-shirt dress women,Hemlock Women Lady Long Prom Gown Dress Lace Formal Party Dress Sleeveless Mermaid Bodycon Dress,102394,https://www.amazon.com/dp/B07YD6QM4M,2
T-shirt dress women,"FUNEY Womens Pullover Fleece Crewneck Sweatshirt Casual Warm Sherpa Lined Sport Loungewear Tunic Tops Blouse for Winter, Z-blue",58134,https://www.amazon.com/dp/B09H6TPVRD,4
T-shirt dress women,"FUNEY Womens Pullover Fleece Crewneck Sweatshirt Casual Warm Sherpa Lined Sport Loungewear Tunic Tops Blouse for Winter, Z-black, X-Large",295218,https://www.amazon.com/dp/B09H6QSW3H,4
T-shirt dress women,Women's Dresses Summer Casual Multi-Button Denim Maxi Dress Lapel Short Sleeve Loose Long Jeans Dress with Pockets,198452,https://www.amazon.com/dp/B08VWNWTCJ,3
T-shirt dress women,"Women Dress Clearance! Daoroka Plus Size Long Casual Slim Stripe Split Sport Sundress Short Sleeve Fashion Ankle-Length Dress (4XL, Black)",22353,https://www.amazon.com/dp/B07FCJCBYK,3
T-shirt dress women,Swrowesi Women's Long Sleeve Knit Long Cardigan Open Front Button Sweater Outerwear Soft Winter Fall Coat,476804,https://www.amazon.com/dp/B0B9XRLVNT,1
